{
  "actions": [],
  "admission_policy": {},
  "archetypes": [],
  "compatibility": "Optional zone combat for FACETS 0.1.0.",
  "conditions": [],
  "dependencies": {
    "facets.core": "0.1.0"
  },
  "pack_id": "facets.combat",
  "ruleset_id": "facets.core",
  "ruleset_version": "0.1.0",
  "schema_version": 1,
  "skills": [],
  "talents": [
    {
      "description": "Use your reaction to take a hit meant for an ally in your zone along a clear path. Your armor applies. Once per round; interceptions never chain.",
      "display_name": "Bodyguard",
      "hook_id": "bodyguard",
      "id": "combat.bodyguard",
      "package": "combat",
      "parameters": {
        "uses_per_round": 1
      },
      "prerequisites": {
        "facets": {},
        "skills": {
          "fighting": 1
        },
        "talents": []
      },
      "repeatable": false,
      "usage_scope": "per_round",
      "uses": 1,
      "version": 1
    },
    {
      "description": "While Overwhelmed, take one normal turn (move and action) once per scene. It does not restore your reaction or let you act while Incapacitated.",
      "display_name": "Last Reserve",
      "hook_id": "last_reserve",
      "id": "combat.last_reserve",
      "package": "combat",
      "parameters": {
        "uses_per_scene": 1
      },
      "prerequisites": {
        "facets": {
          "tenacity": 3
        },
        "skills": {},
        "talents": []
      },
      "repeatable": false,
      "usage_scope": "per_scene",
      "uses": 1,
      "version": 1
    }
  ],
  "version": "0.1.0"
}
